{
  "model": "iML1515",
  "scale": "medium",
  "n_cols": 2712,
  "shipped_default": {
    "configuration": "shipped_default",
    "source": "reused",
    "solve_s": 3.75,
    "iterations": 124400,
    "status": "Optimal",
    "objective": 0.876997198833092,
    "residual_inf": 2.9543798518716358e-09,
    "rows_violated": null,
    "time_limit": 900.0
  },
  "residual_0": {
    "configuration": "residual_0",
    "source": "fresh",
    "solve_s": 3.8179,
    "iterations": 124600,
    "status": "Optimal",
    "objective": 0.8769971989117845,
    "residual_inf": 4.445610102266073e-09,
    "rows_violated": 0,
    "time_limit": 900.0,
    "violation_histogram_equations": {
      "bin_edges": [
        1e-09,
        3.1622776601683795e-09,
        1e-08,
        3.162277660168379e-08,
        1e-07,
        3.162277660168379e-07,
        1e-06,
        3.162277660168379e-06,
        9.999999999999999e-06,
        3.1622776601683795e-05,
        0.0001,
        0.00031622776601683794,
        0.001,
        0.0031622776601683794,
        0.01,
        0.03162277660168379,
        0.1,
        0.31622776601683794,
        1.0,
        3.1622776601683795,
        10.0,
        31.622776601683793,
        100.0,
        316.2277660168379,
        1000.0
      ],
      "shortfall_counts": [
        0,
        0,
        0,
        0,
        0,
        0,
        0,
        0,
        0,
        0,
        0,
        0,
        0,
        0,
        0,
        0,
        0,
        0,
        0,
        0,
        0,
        0,
        0,
        0
      ],
      "excess_counts": [
        5,
        2,
        0,
        0,
        0,
        0,
        0,
        0,
        0,
        0,
        0,
        0,
        0,
        0,
        0,
        0,
        0,
        0,
        0,
        0,
        0,
        0,
        0,
        0
      ],
      "n_rows": 1877,
      "n_satisfied": 1870
    },
    "violation_histogram_constraints": null
  },
  "gurobi": {
    "configuration": "gurobi",
    "source": "reused",
    "solve_s": 0.033730380702763796,
    "iterations": 26,
    "status": "Optimal",
    "objective": 0.8769972144269654,
    "residual_inf": 1.1652900866465643e-12,
    "rows_violated": null,
    "time_limit": 900.0
  },
  "speedup_residual_0_vs_shipped": 0.9822153539904136,
  "violation_ratio_residual_0_vs_shipped": 1.504752376188094
}